{
  "rres_version": "0.1",
  "record_type": "high_value_authorization",
  "decision_context": {
    "timestamp": "2026-01-04T12:15:00Z",
    "jurisdiction": "EU"
  },
  "controls_applied": [
    {
      "control_id": "PAD_LIVENESS_V3",
      "control_type": "presentation_attack_detection",
      "result": "PASS"
    },
    {
      "control_id": "MFA_TOTP",
      "control_type": "multi_factor_authentication",
      "result": "PASS"
    }
  ],
  "outcomes": {
    "final_decision": "ALLOW"
  },
  "record_hash": "aaaaaaaaaaaaaaaaaaaaaaaaaaaaaaaaaaaaaaaaaaaaaaaaaaaaaaaaaaaaaaaa"
}
